{"schemaVersion":"behavior-v1","modelVersion":"mp-face-pose-v1","thresholdsVersion":"behavior-policy-v1","videoId":"501","durationMs":60000,"sampleIntervalMs":200,"sampledFrameCount":300,"sampledDurationMs":60000,"metrics":{"faceVisibleRatio":{"status":"AVAILABLE","value":0.0,"numeratorMs":0,"denominatorMs":60000,"coverageRatio":1.0,"unavailableReason":null},"headFacingRatio":{"status":"UNAVAILABLE","value":null,"numeratorMs":0,"denominatorMs":0,"coverageRatio":0.0,"unavailableReason":"NO_SINGLE_FACE"},"shoulderLevelRatio":{"status":"UNAVAILABLE","value":null,"numeratorMs":0,"denominatorMs":0,"coverageRatio":0.0,"unavailableReason":"NO_SINGLE_FACE"},"upperBodyStableRatio":{"status":"UNAVAILABLE","value":null,"numeratorMs":0,"denominatorMs":0,"coverageRatio":0.0,"unavailableReason":"NO_SINGLE_FACE"},"smileShapeRatio":{"status":"UNAVAILABLE","value":null,"numeratorMs":0,"denominatorMs":0,"coverageRatio":0.0,"unavailableReason":"NO_SINGLE_FACE"}},"timeline":[{"startMs":0,"endMs":10000,"metrics":{"faceVisibleRatio":{"numeratorMs":0,"denominatorMs":10000},"headFacingRatio":{"numeratorMs":0,"denominatorMs":0},"shoulderLevelRatio":{"numeratorMs":0,"denominatorMs":0},"upperBodyStableRatio":{"numeratorMs":0,"denominatorMs":0},"smileShapeRatio":{"numeratorMs":0,"denominatorMs":0}}},{"startMs":10000,"endMs":20000,"metrics":{"faceVisibleRatio":{"numeratorMs":0,"denominatorMs":10000},"headFacingRatio":{"numeratorMs":0,"denominatorMs":0},"shoulderLevelRatio":{"numeratorMs":0,"denominatorMs":0},"upperBodyStableRatio":{"numeratorMs":0,"denominatorMs":0},"smileShapeRatio":{"numeratorMs":0,"denominatorMs":0}}},{"startMs":20000,"endMs":30000,"metrics":{"faceVisibleRatio":{"numeratorMs":0,"denominatorMs":10000},"headFacingRatio":{"numeratorMs":0,"denominatorMs":0},"shoulderLevelRatio":{"numeratorMs":0,"denominatorMs":0},"upperBodyStableRatio":{"numeratorMs":0,"denominatorMs":0},"smileShapeRatio":{"numeratorMs":0,"denominatorMs":0}}},{"startMs":30000,"endMs":40000,"metrics":{"faceVisibleRatio":{"numeratorMs":0,"denominatorMs":10000},"headFacingRatio":{"numeratorMs":0,"denominatorMs":0},"shoulderLevelRatio":{"numeratorMs":0,"denominatorMs":0},"upperBodyStableRatio":{"numeratorMs":0,"denominatorMs":0},"smileShapeRatio":{"numeratorMs":0,"denominatorMs":0}}},{"startMs":40000,"endMs":50000,"metrics":{"faceVisibleRatio":{"numeratorMs":0,"denominatorMs":10000},"headFacingRatio":{"numeratorMs":0,"denominatorMs":0},"shoulderLevelRatio":{"numeratorMs":0,"denominatorMs":0},"upperBodyStableRatio":{"numeratorMs":0,"denominatorMs":0},"smileShapeRatio":{"numeratorMs":0,"denominatorMs":0}}},{"startMs":50000,"endMs":60000,"metrics":{"faceVisibleRatio":{"numeratorMs":0,"denominatorMs":10000},"headFacingRatio":{"numeratorMs":0,"denominatorMs":0},"shoulderLevelRatio":{"numeratorMs":0,"denominatorMs":0},"upperBodyStableRatio":{"numeratorMs":0,"denominatorMs":0},"smileShapeRatio":{"numeratorMs":0,"denominatorMs":0}}}],"events":[{"type":"FACE_NOT_VISIBLE","sourceMetric":"faceVisibleRatio","startMs":0,"endMs":60000}],"eventsTruncated":false,"summary":["얼굴이 관찰된 구간은 판단 가능한 시간의 0.0%입니다."],"warnings":["LOW_FACE_COVERAGE","LOW_POSE_COVERAGE"]}
