{"schemaVersion":"behavior-v1","modelVersion":"mp-face-pose-v1","thresholdsVersion":"behavior-policy-v1","videoId":"501","durationMs":60000,"sampleIntervalMs":200,"sampledFrameCount":300,"sampledDurationMs":60000,"metrics":{"faceVisibleRatio":{"status":"AVAILABLE","value":0.95,"numeratorMs":57000,"denominatorMs":60000,"coverageRatio":1.0,"unavailableReason":null},"headFacingRatio":{"status":"AVAILABLE","value":0.8,"numeratorMs":43200,"denominatorMs":54000,"coverageRatio":0.9,"unavailableReason":null},"shoulderLevelRatio":{"status":"UNAVAILABLE","value":null,"numeratorMs":0,"denominatorMs":0,"coverageRatio":0.0,"unavailableReason":"SHOULDERS_NOT_VISIBLE"},"upperBodyStableRatio":{"status":"UNAVAILABLE","value":null,"numeratorMs":0,"denominatorMs":0,"coverageRatio":0.0,"unavailableReason":"SHOULDERS_NOT_VISIBLE"},"smileShapeRatio":{"status":"AVAILABLE","value":0.15,"numeratorMs":8100,"denominatorMs":54000,"coverageRatio":0.9,"unavailableReason":null}},"timeline":[{"startMs":0,"endMs":10000,"metrics":{"faceVisibleRatio":{"numeratorMs":10000,"denominatorMs":10000},"headFacingRatio":{"numeratorMs":8000,"denominatorMs":10000},"shoulderLevelRatio":{"numeratorMs":0,"denominatorMs":0},"upperBodyStableRatio":{"numeratorMs":0,"denominatorMs":0},"smileShapeRatio":{"numeratorMs":1500,"denominatorMs":10000}}},{"startMs":10000,"endMs":20000,"metrics":{"faceVisibleRatio":{"numeratorMs":10000,"denominatorMs":10000},"headFacingRatio":{"numeratorMs":8000,"denominatorMs":10000},"shoulderLevelRatio":{"numeratorMs":0,"denominatorMs":0},"upperBodyStableRatio":{"numeratorMs":0,"denominatorMs":0},"smileShapeRatio":{"numeratorMs":1500,"denominatorMs":10000}}},{"startMs":20000,"endMs":30000,"metrics":{"faceVisibleRatio":{"numeratorMs":7000,"denominatorMs":10000},"headFacingRatio":{"numeratorMs":5600,"denominatorMs":7000},"shoulderLevelRatio":{"numeratorMs":0,"denominatorMs":0},"upperBodyStableRatio":{"numeratorMs":0,"denominatorMs":0},"smileShapeRatio":{"numeratorMs":1050,"denominatorMs":7000}}},{"startMs":30000,"endMs":40000,"metrics":{"faceVisibleRatio":{"numeratorMs":10000,"denominatorMs":10000},"headFacingRatio":{"numeratorMs":7200,"denominatorMs":9000},"shoulderLevelRatio":{"numeratorMs":0,"denominatorMs":0},"upperBodyStableRatio":{"numeratorMs":0,"denominatorMs":0},"smileShapeRatio":{"numeratorMs":1350,"denominatorMs":9000}}},{"startMs":40000,"endMs":50000,"metrics":{"faceVisibleRatio":{"numeratorMs":10000,"denominatorMs":10000},"headFacingRatio":{"numeratorMs":7200,"denominatorMs":9000},"shoulderLevelRatio":{"numeratorMs":0,"denominatorMs":0},"upperBodyStableRatio":{"numeratorMs":0,"denominatorMs":0},"smileShapeRatio":{"numeratorMs":1350,"denominatorMs":9000}}},{"startMs":50000,"endMs":60000,"metrics":{"faceVisibleRatio":{"numeratorMs":10000,"denominatorMs":10000},"headFacingRatio":{"numeratorMs":7200,"denominatorMs":9000},"shoulderLevelRatio":{"numeratorMs":0,"denominatorMs":0},"upperBodyStableRatio":{"numeratorMs":0,"denominatorMs":0},"smileShapeRatio":{"numeratorMs":1350,"denominatorMs":9000}}}],"events":[{"type":"HEAD_TURNED","sourceMetric":"headFacingRatio","startMs":10000,"endMs":12000},{"type":"FACE_NOT_VISIBLE","sourceMetric":"faceVisibleRatio","startMs":20000,"endMs":23000}],"eventsTruncated":false,"summary":["얼굴이 관찰된 구간은 판단 가능한 시간의 95.0%입니다.","머리가 카메라 정면 방향으로 추정된 구간은 방향을 판단할 수 있는 시간의 80.0%입니다.","미소와 비슷한 입꼬리 형태가 관찰된 구간은 측정 가능 시간의 15.0%입니다."],"warnings":["LOW_POSE_COVERAGE"]}
